,Category,Subject,Link
0,"""A Guide to....""",A Guide to Books,http://libguides.mcmaster.ca/books
1,"""A Guide to....""",A Guide to Discovery & Catalogue,http://libguides.mcmaster.ca/discovery
2,"""A Guide to....""",A Guide to Government Publications,http://libguides.mcmaster.ca/government-publications
3,"""A Guide to....""",A Guide to Images,http://libguides.mcmaster.ca/images
4,"""A Guide to....""",A Guide to Journal Articles,http://libguides.mcmaster.ca/journal-articles
5,"""A Guide to....""",A Guide to Microforms,http://libguides.mcmaster.ca/microforms
6,"""A Guide to....""",A Guide to Music,http://libguides.mcmaster.ca/music
7,"""A Guide to....""",A Guide to Newspapers,http://libguides.mcmaster.ca/newspapers
8,"""A Guide to....""",A Guide to Primary Sources,http://libguides.mcmaster.ca/primary-sources
9,"""A Guide to....""","A Guide to Reviews (Books, Film & Theatre)",http://libguides.mcmaster.ca/reviews
10,"""A Guide to....""",A Guide to Theses & Dissertations,http://libguides.mcmaster.ca/theses-dissertations
11,"""A Guide to....""",A Guide to Videos & Films,http://libguides.mcmaster.ca/videos-films
12,"""How Do I...?""",How Do I Cite Government Publications?,http://libguides.mcmaster.ca/cite-government-publications
13,"""How Do I...?""",How Do I Cite in APA?,http://libguides.mcmaster.ca/APA
14,"""How Do I...?""",How Do I Cite in Chicago for Business?,http://libguides.mcmaster.ca/businesscitation
15,"""How Do I...?""",How Do I Cite in MLA?,http://libguides.mcmaster.ca/MLA
16,"""How Do I...?""",How Do I Cite in Turabian (Chicago)?,http://libguides.mcmaster.ca/Turabian
17,"""How Do I...?""",How Do I Cite Maps and Atlases?,http://libguides.mcmaster.ca/cite-maps
18,"""How Do I...?""",How Do I Cite Unpublished Sources?,http://libguides.mcmaster.ca/cite-unpublished-sources
19,"""How Do I...?""",How Do I Do Genealogical Research?,http://libguides.mcmaster.ca/genealogical-research
20,"""How Do I...?""",How Do I Find Articles?,http://libguides.mcmaster.ca/find-articles
21,"""How Do I...?""",How Do I Find Book Reviews?,http://libguides.mcmaster.ca/find-book-reviews
22,"""How Do I...?""",How Do I Find Books?,http://libguides.mcmaster.ca/find-books
23,"""How Do I...?""",How Do I Find Business Cases?,http://libguides.mcmaster.ca/business-cases
24,"""How Do I...?""",How Do I Find Business Databases?,http://libguides.mcmaster.ca/databases
25,"""How Do I...?""",How Do I Find Canadian Case Law?,http://libguides.mcmaster.ca/case-law
26,"""How Do I...?""",How Do I Find Collective Agreements?,http://libguides.mcmaster.ca/collective-agreements
27,"""How Do I...?""",How Do I Find Company Annual Reports?,http://libguides.mcmaster.ca/company
28,"""How Do I...?""",How do I Find Conference Proceedings?,http://libguides.mcmaster.ca/proceedings
29,"""How Do I...?""",How Do I Find Financial Ratios?,http://libguides.mcmaster.ca/financial-ratios
30,"""How Do I...?""",How Do I Find Government Publications?,http://libguides.mcmaster.ca/find-government-publications
31,"""How Do I...?""",How Do I Find Grey Literature?,http://libguides.mcmaster.ca/find-grey-literature
32,"""How Do I...?""","How Do I Find Historical Journal, Magazine and Newspaper Articles?",http://libguides.mcmaster.ca/find-historical-articles
33,"""How Do I...?""",How Do I Find Industry Reports?,http://libguides.mcmaster.ca/industry-reports
34,"""How Do I...?""",How Do I Find Journals?,http://libguides.mcmaster.ca/find-journals
35,"""How Do I...?""",How Do I Find Library Catalogues?,http://libguides.mcmaster.ca/library-catalogues
36,"""How Do I...?""",How Do I Find Market Share?,http://libguides.mcmaster.ca/market-share
37,"""How Do I...?""",How Do I Find McMaster Business Theses?,http://libguides.mcmaster.ca/business-theses
38,"""How Do I...?""",How Do I Find McMaster Business Working Papers?,http://libguides.mcmaster.ca/business-working-papers
39,"""How Do I...?""","How Do I Find Music, Spoken Records & Sound Recordings?",http://libguides.mcmaster.ca/find-music
40,"""How Do I...?""",How Do I Find My Way Around the Library?,http://libguides.mcmaster.ca/library
41,"""How Do I...?""",How Do I Find News?,http://libguides.mcmaster.ca/news
42,"""How Do I...?""",How Do I Find Patents?,http://libguides.mcmaster.ca/patents
43,"""How Do I...?""",How do I Find Standards?,http://libguides.mcmaster.ca/standards
44,"""How Do I...?""",How Do I Find SWOT Analyses?,http://libguides.mcmaster.ca/swot
45,"""How Do I...?""",How Do I Find Technical Reports?,http://libguides.mcmaster.ca/reports
46,"""How Do I...?""",How Do I Find the 50 Journals used in the FT Research Rank?,http://libguides.mcmaster.ca/ft-top50
47,"""How Do I...?""",How Do I Find Theses & Dissertations?,http://libguides.mcmaster.ca/find-theses
48,"""How Do I...?""",How Do I Find Videos & Film?,http://libguides.mcmaster.ca/find-videos
49,"""How Do I...?""",How Do I Link to e-Resources?,http://libguides.mcmaster.ca/link-eresources
50,"""How Do I...?""",How Do I Search the Web?,http://libguides.mcmaster.ca/web-search
51,"""How Do I...?""",How Do I Subscribe to Alerts & RSS Feeds,http://libguides.mcmaster.ca/alerts-rssfeeds
52,"""How Do I...?""",How Do I Track Citations?,http://libguides.mcmaster.ca/track-citations
53,Anthropology,Anthro 1AA3 - Fall 2018,http://libguides.mcmaster.ca/anthro1aa3-f18
54,Anthropology,Anthro 1AA3 - Winter 2018,http://libguides.mcmaster.ca/Anthro1AA3
55,Anthropology,Anthro 1AB3 - Fall 2017,http://libguides.mcmaster.ca/Anthro1AB3
56,Anthropology,Anthro 1AB3 - Summer 2018,http://libguides.mcmaster.ca/Anthro1AB3-S18
57,Anthropology,Anthro 2O03 - Fall 2017,http://libguides.mcmaster.ca/Anthro2O03
58,Biology,Biology Thesis,http://libguides.mcmaster.ca/BioThesis
59,Business,Business Data and Statistics,http://libguides.mcmaster.ca/c.php?g=704161
60,Business,Commerce 1B03 - Business Environment & Organization,http://libguides.mcmaster.ca/commerce1b03
61,Business,Commerce 1E03 - Business Environment & Organization,http://libguides.mcmaster.ca/commerce1e03
62,Business,Commerce 2BC3 - Human Resource Management & Labour Relations,http://libguides.mcmaster.ca/commerce2bc3
63,Business,Commerce 2MA3 - Introduction to Marketing,http://libguides.mcmaster.ca/commerce2ma3
64,Business,Commerce 2QA3 - Applied Statistics for Business,http://libguides.mcmaster.ca/commerce2qa3
65,Business,Commerce 3MC3 - Applied Marketing Management,http://libguides.mcmaster.ca/commerce3mc3
66,Business,Commerce 4BL3 - Occupational Health & Safety Management,http://libguides.mcmaster.ca/commerce4bl3
67,Business,Commerce 4KH3 - Strategies for Electronic and Mobile Business,http://libguides.mcmaster.ca/commerce4kh3
68,Business,Commerce 4SA3 - International Business,http://libguides.mcmaster.ca/commerce4sa3
69,Business,EMBA Research Guide,http://libguides.mcmaster.ca/emba
70,Business,How Do I Cite in Chicago for Business?,http://libguides.mcmaster.ca/businesscitation
71,Business,How Do I Find Business Cases?,http://libguides.mcmaster.ca/business-cases
72,Business,How Do I Find Business Databases?,http://libguides.mcmaster.ca/databases
73,Business,How Do I Find Canadian Case Law?,http://libguides.mcmaster.ca/case-law
74,Business,How Do I Find Collective Agreements?,http://libguides.mcmaster.ca/collective-agreements
75,Business,How Do I Find Company Annual Reports?,http://libguides.mcmaster.ca/company
76,Business,How Do I Find Financial Ratios?,http://libguides.mcmaster.ca/financial-ratios
77,Business,How Do I Find Industry Reports?,http://libguides.mcmaster.ca/industry-reports
78,Business,How Do I Find Market Share?,http://libguides.mcmaster.ca/market-share
79,Business,How Do I Find McMaster Business Theses?,http://libguides.mcmaster.ca/business-theses
80,Business,How Do I Find McMaster Business Working Papers?,http://libguides.mcmaster.ca/business-working-papers
81,Business,How Do I Find News?,http://libguides.mcmaster.ca/news
82,Business,How Do I Find Patents?,http://libguides.mcmaster.ca/patents
83,Business,How Do I Find SWOT Analyses?,http://libguides.mcmaster.ca/swot
84,Business,How Do I Find the 50 Journals used in the FT Research Rank?,http://libguides.mcmaster.ca/ft-top50
85,Business,MBA Research Guide,http://libguides.mcmaster.ca/c.php?g=702993
86,Canadian History,History 2HI3 (Frager) - Fall 2017,http://libguides.mcmaster.ca/History2HI3Frager
87,Canadian History,History 2HI3 (Frager) - Fall 2018,http://libguides.mcmaster.ca/History2HI3Frager-F18
88,Canadian History,History 2HI3 (Tunnicliffe) - Fall 2017,http://libguides.mcmaster.ca/History2HI3Tunnicliffe
89,Communication Studies,CMST 4E03 - Fall 2017,http://libguides.mcmaster.ca/CMST4E03
90,Communication Studies,CMST 4E03 - Winter 2018,http://libguides.mcmaster.ca/CMST4E03Rose
91,Data and Statistics,A Guide to Data and Statistical Sources from Statistics Canada,http://libguides.mcmaster.ca/c.php?g=703562
92,Data and Statistics,Business Data and Statistics,http://libguides.mcmaster.ca/c.php?g=704161
93,Engineering,Eng Socty 2X03 - Fall 2017,http://libguides.mcmaster.ca/EngSocty2X03
94,Engineering,Engineering Physics 4ES3,http://libguides.mcmaster.ca/engphys
95,Engineering,How do I Find Conference Proceedings?,http://libguides.mcmaster.ca/proceedings
96,Engineering,How Do I Find Patents?,http://libguides.mcmaster.ca/patents
97,Engineering,How do I Find Standards?,http://libguides.mcmaster.ca/standards
98,Engineering,How Do I Find Technical Reports?,http://libguides.mcmaster.ca/reports
99,Engineering,Materials Science 4Z06,http://libguides.mcmaster.ca/MatSci
100,Engineering,Mechanical Engineering 4M06,http://libguides.mcmaster.ca/MechEng
101,Engineering and Society,Eng Socty 2X03 - Fall 2017,http://libguides.mcmaster.ca/EngSocty2X03
102,English Literature,English 2CR3 - Fall 2017,http://libguides.mcmaster.ca/English2CR3
103,French Literature,FRENCH 3P03 - Fall 2018,http://libguides.mcmaster.ca/french3p03-f18
104,Globalization,Global St 1A03 - Fall 2017,http://libguides.mcmaster.ca/GlobalSt1A03
105,"Health, Aging and Society",Hlth Age 1AA3 - Fall 2017,http://libguides.mcmaster.ca/HlthAge1AA3
106,"Health, Aging and Society",Hlth Age 1AA3 CO1 (Voros) - Winter 2018,http://libguides.mcmaster.ca/HlthAge1AA3Voros
107,"Health, Aging and Society",Hlth Age 3B03 - Winter 2018,http://libguides.mcmaster.ca/HlthAge3B03
108,History,History 2HI3 (Frager) - Fall 2017,http://libguides.mcmaster.ca/History2HI3Frager
109,History,History 2HI3 (Frager) - Fall 2018,http://libguides.mcmaster.ca/History2HI3Frager-F18
110,History,History 2HI3 (Green-Stewart) - Fall 2017,http://libguides.mcmaster.ca/History2HI3Green
111,History,History 2HI3 (Tunnicliffe) - Fall 2017,http://libguides.mcmaster.ca/History2HI3Tunnicliffe
112,History,"How Do I Find Historical Journal, Magazine and Newspaper Articles?",http://libguides.mcmaster.ca/find-historical-articles
113,History,How Do I Find News?,http://libguides.mcmaster.ca/news
114,How to Research,Graduate Guide to Research,http://libguides.mcmaster.ca/gradresearchguide
115,How to Research,Undergraduate Guide to Research,http://libguides.mcmaster.ca/UndergradResearchGuide
116,Indigenous Studies,Indig St 2M03 - Fall 2018,http://libguides.mcmaster.ca/IndigSt2MO3
117,Indigenous Studies,Indig St 2M06 - Fall 2017,http://libguides.mcmaster.ca/IndigSt2M06
118,Indigenous Studies,Indig St 3H03 - Fall 2017,http://libguides.mcmaster.ca/IndigSt3H03
119,Labour Studies,How Do I Find Canadian Case Law?,http://libguides.mcmaster.ca/case-law
120,Labour Studies,How Do I Find Collective Agreements?,http://libguides.mcmaster.ca/collective-agreements
121,Library Research Skills Tutorial,Library Research Skills Tutorial,http://libguides.mcmaster.ca/library-research-skills
122,Materials Science Engineering,Materials Science 4Z06,http://libguides.mcmaster.ca/MatSci
123,Mechanical Engineering,Mechanical Engineering 4M06,http://libguides.mcmaster.ca/MechEng
124,Open Educational Resources,Open Educational Resources (OER),http://libguides.mcmaster.ca/oer
125,Political Science,How Do I Cite Government Publications?,http://libguides.mcmaster.ca/cite-government-publications
126,Political Science,How Do I Find Canadian Case Law?,http://libguides.mcmaster.ca/case-law
127,Political Science,How Do I Find Government Publications?,http://libguides.mcmaster.ca/find-government-publications
128,Political Science,Poli Sci 1AA3 - Fall 2017,http://libguides.mcmaster.ca/PoliSci1AA3
129,Political Science,Poli Sci 1AA3 - Fall 2018,http://libguides.mcmaster.ca/PoliSci1AA3-F18
130,Political Science,Poli Sci 1AB3 - Winter 2018,http://libguides.mcmaster.ca/PoliSci1AA3Alway
131,Political Science,Poli Sci 4CF3 - Fall 2017,http://libguides.mcmaster.ca/PoliSci4CF3
132,Psychology,PNB 4D09 - Fall 2017,http://libguides.mcmaster.ca/PNB4D09
133,Psychology,PNB 4SC6 - Fall 2017,http://libguides.mcmaster.ca/PNB4SC6
134,Science,How do I Find Conference Proceedings?,http://libguides.mcmaster.ca/proceedings
135,Science,How Do I Find Technical Reports?,http://libguides.mcmaster.ca/reports
136,Social Sciences,Soc Sci 1SS3 CO3 (Janzen) - Fall 2018,http://libguides.mcmaster.ca/SocSci1SS3Janzen-F18
137,Social Sciences,Soc Sci 1SS3 Section CO1 (Knight-Messenger) - Winter 2018,http://libguides.mcmaster.ca/SocSci1SS3Knight
138,Social Sciences,Soc Sci 1SS3 Section CO2 (Jurgutis) - Winter 2018,http://libguides.mcmaster.ca/SocSci1SS3Jurgutis
139,Social Sciences,Soc Sci 1SS3 Section CO2 (Tozer) - Fall 2017,http://libguides.mcmaster.ca/SocSci1SS3Tozer
140,Social Sciences,Soc Sci 1SS3 Section CO3 (Janzen) - Fall 2017,http://libguides.mcmaster.ca/SocSci1SS3Janzen
141,Social Sciences,Soc Sci 1SS3 Section CO4 (Braimoh) - Fall 2017,http://libguides.mcmaster.ca/SocSci1SS3Braimoh
142,Social Sciences,Soc Sci 1SS3 Section CO4 (Gouweloos) - Winter 2018,http://libguides.mcmaster.ca/SocSci1SS3Gouweloos
143,Social Sciences,Soc Sci 1SS3 Section EVE07 (Baker) - Fall 2017,http://libguides.mcmaster.ca/SocSci1SS3Baker
144,Sustainability,Sustain 4S06 - Fall 2017,http://libguides.mcmaster.ca/Sustain4S06
