,Category,Subject,Link
0,*How To/Research Tips,Academic Productivity Tools,https://guides.main.library.emory.edu/productivity-tools
1,*How To/Research Tips,Archive and Library Grants,https://guides.main.library.emory.edu/archive-library-grants
2,*How To/Research Tips,Citing Your Sources,https://guides.main.library.emory.edu/citing_your_sources
3,*How To/Research Tips,Currey Seminar,https://guides.main.library.emory.edu/c.php?g=485360
4,*How To/Research Tips,"Digital Image Guide - Finding, Using, and Creating Digital Image Collections",https://guides.main.library.emory.edu/DigitalImages
5,*How To/Research Tips,E-books,https://guides.main.library.emory.edu/ebooks
6,*How To/Research Tips,Equipment Collections at Emory,https://guides.main.library.emory.edu/equipment
7,*How To/Research Tips,Find Articles at Woodruff,https://guides.main.library.emory.edu/finding_articles
8,*How To/Research Tips,"Find it, Use it, Get Help",https://guides.main.library.emory.edu/Research_Info
9,*How To/Research Tips,Finding Dissertations,https://guides.main.library.emory.edu/dissertations
10,*How To/Research Tips,Free Audiobooks Guide,https://guides.main.library.emory.edu/audiobooks
11,*How To/Research Tips,"Grants, Fellowships & Scholarships for Undergraduates",https://guides.main.library.emory.edu/undergraduate_grants
12,*How To/Research Tips,"Grants, Foundations, and Scholarships",https://guides.main.library.emory.edu/Grants
13,*How To/Research Tips,How do I find newspapers?,https://guides.main.library.emory.edu/united-states-newspapers
14,*How To/Research Tips,Impact Factors and Citation Analysis,https://guides.main.library.emory.edu/citationanalysis
15,*How To/Research Tips,LibX Library Plug-in,https://guides.main.library.emory.edu/libx
16,*How To/Research Tips,Preservation and Conservation,https://guides.main.library.emory.edu/preservation
17,*How To/Research Tips,Primary Sources Research Guide,https://guides.main.library.emory.edu/primary_sources_overview
18,*How To/Research Tips,Research Data Management,https://guides.main.library.emory.edu/datamgmt
19,*How To/Research Tips,Resources in DiscoverE,https://guides.main.library.emory.edu/discovere_databases
20,*Technology Tools,Academic Productivity Tools,https://guides.main.library.emory.edu/productivity-tools
21,*Technology Tools,"Digital Image Guide - Finding, Using, and Creating Digital Image Collections",https://guides.main.library.emory.edu/DigitalImages
22,*Technology Tools,E-books,https://guides.main.library.emory.edu/ebooks
23,*Technology Tools,EndNote,https://guides.main.library.emory.edu/endnote
24,*Technology Tools,Equipment Collections at Emory,https://guides.main.library.emory.edu/equipment
25,*Technology Tools,LibX Library Plug-in,https://guides.main.library.emory.edu/libx
26,*Technology Tools,Zotero,https://guides.main.library.emory.edu/zotero
27,African American Studies,AAS/ARTHIST 389 Art of the Harlem Renaissance,https://guides.main.library.emory.edu/HarlemRenaissance
28,African American Studies,AAS495A: African American Studies Honors Research,https://guides.main.library.emory.edu/AFAM_Honors
29,African American Studies,African American History and Culture (Rose Library),https://guides.main.library.emory.edu/c.php?g=50191
30,African American Studies,African American Newspapers,https://guides.main.library.emory.edu/african-american-news
31,African American Studies,African American Studies Research Guide,https://guides.main.library.emory.edu/african-american-studies
32,African American Studies,American Human Rights Policy,https://guides.main.library.emory.edu/human-rights
33,African American Studies,Civil Rights Cold Cases,https://guides.main.library.emory.edu/cold-cases
34,African American Studies,Data Resources: Political Economy of Violence and Non-Violence (MESAS 370-003),https://guides.main.library.emory.edu/EDC_MESAS370_003
35,African American Studies,History of African Americans Since 1865,https://guides.main.library.emory.edu/AfricanAmericanHistory1865present
36,African American Studies,Political Science 385/African American Studies 385: New Black Political Leadership,https://guides.main.library.emory.edu/new_black_leadership
37,African American Studies,"Political Science 494/WGS 475: Gender, Race and Political Representation in the U.S.",https://guides.main.library.emory.edu/pols490_race_gender_representation
38,African American Studies,The Black Athlete and American Society,https://guides.main.library.emory.edu/black-athlete
39,African American Studies,The Civil Rights Movement,https://guides.main.library.emory.edu/civil-rights-movement
40,African American Studies,US Cold War and Foreign Policy,https://guides.main.library.emory.edu/cold-war-foreign-policy
41,African American Studies,War Crimes and Genocide,https://guides.main.library.emory.edu/war-crimes
42,African Studies,*African Studies Research Guide,https://guides.main.library.emory.edu/africa1
43,African Studies,*African Studies Research Guide: Films,https://guides.main.library.emory.edu/africa2
44,African Studies,*African Studies Research Guide: News,https://guides.main.library.emory.edu/africa3
45,African Studies,*African Studies Research Guide: Primary Sources,https://guides.main.library.emory.edu/africa4
46,African Studies,African Literature,https://guides.main.library.emory.edu/africanliterature
47,African Studies,Chinese-African Relations,https://guides.main.library.emory.edu/chineseafrica
48,African Studies,Data Resources: Development Issues for Africa (AFS 366W/ECON 366W),https://guides.main.library.emory.edu/EDC_ECON366-000
49,African Studies,Development Practice,https://guides.main.library.emory.edu/developmentstudies1
50,African Studies,"Francophone World Resources: Africa, the Americas, Asia, and the Caribbean",https://guides.main.library.emory.edu/FrancophoneWorld
51,African Studies,Gender and Sexuality in Africa,https://guides.main.library.emory.edu/GenderSexualityAfrica
52,African Studies,Health and Disease in Africa,https://guides.main.library.emory.edu/AfricaHealth
53,African Studies,Nelson Mandela,https://guides.main.library.emory.edu/mandela
54,African Studies,War Crimes and Genocide,https://guides.main.library.emory.edu/war-crimes
55,American Studies,Literature and Environment Research Guide,https://guides.main.library.emory.edu/c.php?g=50791
56,Anthropology,ANT 385W: Muslims in and of the West,https://guides.main.library.emory.edu/c.php?g=875984
57,Anthropology,Anthropology Journals,https://guides.main.library.emory.edu/anthjournals
58,Anthropology,Anthropology of Death (ANT369W),https://guides.main.library.emory.edu/anthdeath
59,Anthropology,Anthropology Research Guide,https://guides.main.library.emory.edu/anthropology_research
60,Anthropology,China: Anthropological Perspectives (ANT 280),https://guides.main.library.emory.edu/anthro_china
61,Anthropology,Concepts & Methods in Biological Anthropology (ANT 201),https://guides.main.library.emory.edu/bioanth
62,Anthropology,Data Resources and Support,https://guides.main.library.emory.edu/Data_Services
63,Anthropology,Data Resources for International Development,https://guides.main.library.emory.edu/EDC_DEVEL
64,Anthropology,Evolutionary Medicine (ANT 334),https://guides.main.library.emory.edu/evolutionarymedicine
65,Anthropology,Fertility and Mortality in Cultural Context (GHCS 300R),https://guides.main.library.emory.edu/fertilityandmortality
66,Anthropology,"From Tortillas to Tostitos: Food Politics, Sustainability and the Microbiome in Latin America (ANT385-003)",https://guides.main.library.emory.edu/c.php?g=208637
67,Anthropology,Gender and Global Health (GHCS 300R),https://guides.main.library.emory.edu/gender_globalhealth
68,Anthropology,Global Health: Biosocial Model (ANT 338W),https://guides.main.library.emory.edu/biosocialhealth
69,Anthropology,Health and Humanities (HLTH 230),https://guides.main.library.emory.edu/medhum
70,Anthropology,New Films for Anthropology,https://guides.main.library.emory.edu/anthronew
71,Anthropology,Other Lives (ANT 190),https://guides.main.library.emory.edu/otherlives
72,Anthropology,Primate Behavior and Ecology (ANT 302),https://guides.main.library.emory.edu/primatebehavior
73,Anthropology,Readings in Anthropology,https://guides.main.library.emory.edu/anthreading
74,Anthropology,"WGS/ANT/EAS 385W Body and Culture in East Asia -- Spring 2018, Zhang",https://guides.main.library.emory.edu/body_and_culture
75,Archives and Primary Sources,Primary Sources Research Guide,https://guides.main.library.emory.edu/primary_sources_overview
76,Archives and Primary Sources,QEP First-Year Seminar Faculty Toolkit,https://guides.main.library.emory.edu/QEP_Faculty_Toolkit
77,"Art, Architecture, Art History",A Art History Research Guide,https://guides.main.library.emory.edu/ARTHISTORY
78,"Art, Architecture, Art History",AAS/ARTHIST 389 Art of the Harlem Renaissance,https://guides.main.library.emory.edu/HarlemRenaissance
79,"Art, Architecture, Art History",AH 485W | AFS 489W: Art and Evidence: How Do We Learn about Art?,https://guides.main.library.emory.edu/AH485Fall2018
80,"Art, Architecture, Art History",ARTHIST 282 : Arts of Africa: An Introduction (Fall 2018),https://guides.main.library.emory.edu/ArtsofAfricaFall2018
81,"Art, Architecture, Art History",ARTHIST 369R The Architect + the City,https://guides.main.library.emory.edu/ArchitectANDtheCity
82,"Art, Architecture, Art History",ARTHIST495RW: Art History Honors,https://guides.main.library.emory.edu/ArtHistoryHonors
83,"Art, Architecture, Art History",Digital Art History,https://guides.main.library.emory.edu/DigitalArtHistory
84,"Art, Architecture, Art History","Digital Image Guide - Finding, Using, and Creating Digital Image Collections",https://guides.main.library.emory.edu/DigitalImages
85,"Art, Architecture, Art History",Finding Images: a guide to using visual resources,https://guides.main.library.emory.edu/Findingimages
86,"Art, Architecture, Art History",Medieval and Early Modern Literature,https://guides.main.library.emory.edu/medievalearlymodernliterature
87,"Art, Architecture, Art History",The ARTHIST 329 Reconstructing Ancient Rome guide (Fall 2012),https://guides.main.library.emory.edu/ARTHIS329AncientRome
88,Biological Sciences,Ethnobotany,https://guides.main.library.emory.edu/ethnobotany
89,Biology,Ecology,https://guides.main.library.emory.edu/ecology
90,Biology,Ethnobotany,https://guides.main.library.emory.edu/ethnobotany
91,Business,Data Resources and Support,https://guides.main.library.emory.edu/Data_Services
92,Career,"Grants, Foundations, and Scholarships",https://guides.main.library.emory.edu/Grants
93,Career,Researching Graduate Schools,https://guides.main.library.emory.edu/c.php?g=49976
94,Chemistry,CHEM 597R - Course Requirements,https://guides.main.library.emory.edu/chem597r
95,Chemistry,CHEM 597R - Information for January Class,https://guides.main.library.emory.edu/c.php?g=50583
96,Chemistry,"CHEM 597R - Introduction to Research Data Management, Scholarly Publishing, Citation Analysis and Impact Factors",https://guides.main.library.emory.edu/chem597_datamanagement_scholarlypublishing
97,Chemistry,CHEM 597R - Library and Campus Resources (August),https://guides.main.library.emory.edu/resources
98,Chemistry,CHEM 597R - The Scientific Paper and Peer Review,https://guides.main.library.emory.edu/chem597scientificpaper
99,Chemistry,SciFinder,https://guides.main.library.emory.edu/scifinder
100,Chinese Studies,CHN 230: Description and Analysis of the Chinese Language,https://guides.main.library.emory.edu/CHN230
101,Chinese Studies,CHN 368: Writing Women in Traditional China,https://guides.main.library.emory.edu/c.php?g=144988
102,Chinese Studies,CHN 373: Confucian Classics,https://guides.main.library.emory.edu/c.php?g=50832
103,Chinese Studies,Course Guide to CHN 190: MIND AND BODY IN CHINA,https://guides.main.library.emory.edu/Screening-China
104,Chinese Studies,Course Guide to CHN 375: China and the West,https://guides.main.library.emory.edu/ChinaWest
105,Chinese Studies,COURSE GUIDE TO CHN 404: Contemporary Chinese Fiction in the Original,https://guides.main.library.emory.edu/Chinese_Literature
106,Chinese Studies,Course Guide to CHN/EAS/HIST 279W: China after 1976,https://guides.main.library.emory.edu/c.php?g=806339
107,Chinese Studies,Course Guide to CHN272: Literature in Early and Imperial China,https://guides.main.library.emory.edu/ChineseStudies
108,Chinese Studies,Course Guide to CHN278/EAS278/GUST278: REVOLUTIONS & REPUBLICS China in the 20th and 21st Centuries,https://guides.main.library.emory.edu/CHN278
109,Chinese Studies,Course Guide to CHN359: Women and Religion in China,https://guides.main.library.emory.edu/CHN359
110,Chinese Studies,Course Guide to CHN404: Readings in Contemporary Chinese Literature,https://guides.main.library.emory.edu/c.php?g=50140
111,Chinese Studies,Course Guide to EAS271: Modern China in Film and Fiction,https://guides.main.library.emory.edu/EAS271
112,Chinese Studies,Course Guide to EAS450W: East Asian Heritage Language Learning and Teaching,https://guides.main.library.emory.edu/c.php?g=814606
113,Chinese Studies,Course Guide to SOC 389: Contemporary Chinese Society and Culture,https://guides.main.library.emory.edu/c.php?g=571377
114,Classics,A Classics Research Guide,https://guides.main.library.emory.edu/CLASSICSGuide
115,Classics,Women and Family in Roman Law and Life,https://guides.main.library.emory.edu/women_and_roman_law
116,Comparative Literature,A Comparative Literature Research Guide,https://guides.main.library.emory.edu/COMPLIT
117,Comparative Literature,African Literature,https://guides.main.library.emory.edu/africanliterature
118,Comparative Literature,Animal Studies Research Guide,https://guides.main.library.emory.edu/c.php?g=50800
119,Comparative Literature,First-Year Composition Instructor Toolkit,https://guides.main.library.emory.edu/FYCToolkit
120,Comparative Literature,Literature and Environment Research Guide,https://guides.main.library.emory.edu/c.php?g=50791
121,Computer Science,Math & Computer Science Honors Research Guide,https://guides.main.library.emory.edu/mathcomputerscihonors
122,Customer Data,Library Survey Results & Analysis--2013 and previous years,https://guides.main.library.emory.edu/library_surveys
123,Dance,DANC 220 - History of Western Concert Dance,https://guides.main.library.emory.edu/dance_220
124,Dance,DANC 220 - History of Western Concert Dance - Spring 2018,https://guides.main.library.emory.edu/danc_220_spring_2018
125,Dance,Dance Research Guide,https://guides.main.library.emory.edu/dance_general
126,Dance,Yoga Research Guide,https://guides.main.library.emory.edu/yoga
127,Development Studies,Data Resources and Support,https://guides.main.library.emory.edu/Data_Services
128,Development Studies,Data Resources for International Development,https://guides.main.library.emory.edu/EDC_DEVEL
129,Development Studies,Development Practice,https://guides.main.library.emory.edu/developmentstudies1
130,Development Studies,Health and Disease in Africa,https://guides.main.library.emory.edu/AfricaHealth
131,Development Studies,World Inequality and Global Poverty,https://guides.main.library.emory.edu/globalinequality
132,Dissertations,Finding Dissertations,https://guides.main.library.emory.edu/dissertations
133,Dissertations,History Dissertations Arranged by Date,https://guides.main.library.emory.edu/History_Dissertations
134,East Asian Studies,Chinese-African Relations,https://guides.main.library.emory.edu/chineseafrica
135,East Asian Studies,CHN 230: Description and Analysis of the Chinese Language,https://guides.main.library.emory.edu/CHN230
136,East Asian Studies,CHN 368: Writing Women in Traditional China,https://guides.main.library.emory.edu/c.php?g=144988
137,East Asian Studies,CHN 373: Confucian Classics,https://guides.main.library.emory.edu/c.php?g=50832
138,East Asian Studies,Course Guide to CHN 190: MIND AND BODY IN CHINA,https://guides.main.library.emory.edu/Screening-China
139,East Asian Studies,Course Guide to CHN 375: China and the West,https://guides.main.library.emory.edu/ChinaWest
140,East Asian Studies,COURSE GUIDE TO CHN 404: Contemporary Chinese Fiction in the Original,https://guides.main.library.emory.edu/Chinese_Literature
141,East Asian Studies,Course Guide to CHN/EAS/HIST 279W: China after 1976,https://guides.main.library.emory.edu/c.php?g=806339
142,East Asian Studies,Course Guide to CHN272: Literature in Early and Imperial China,https://guides.main.library.emory.edu/ChineseStudies
143,East Asian Studies,Course Guide to CHN278/EAS278/GUST278: REVOLUTIONS & REPUBLICS China in the 20th and 21st Centuries,https://guides.main.library.emory.edu/CHN278
144,East Asian Studies,Course Guide to CHN359: Women and Religion in China,https://guides.main.library.emory.edu/CHN359
145,East Asian Studies,Course Guide to CHN394: Screening China,https://guides.main.library.emory.edu/c.php?g=50144
146,East Asian Studies,Course Guide to CHN404: Readings in Contemporary Chinese Literature,https://guides.main.library.emory.edu/c.php?g=50140
147,East Asian Studies,Course Guide to EAS271: Modern China in Film and Fiction,https://guides.main.library.emory.edu/EAS271
148,East Asian Studies,Course Guide to EAS450W: East Asian Heritage Language Learning and Teaching,https://guides.main.library.emory.edu/c.php?g=814606
149,East Asian Studies,Course Guide to History 489SWR: JR/SR Colloquium: History of Western Medicine in China,https://guides.main.library.emory.edu/c.php?g=49999
150,East Asian Studies,Course Guide to Introduction to East Asian Studies,https://guides.main.library.emory.edu/eastasia
151,East Asian Studies,Course Guide to KRN 271: Political Change and Democracy in Korea,https://guides.main.library.emory.edu/c.php?g=207528
152,East Asian Studies,Course Guide to SOC 389: Contemporary Chinese Society and Culture,https://guides.main.library.emory.edu/c.php?g=571377
153,East Asian Studies,East Asian Studies Research Guide,https://guides.main.library.emory.edu/c.php?g=50845
154,East Asian Studies,Economics/Political Science/International Studies 385: India Today,https://guides.main.library.emory.edu/contemporary_india
155,East Asian Studies,Research Guide to EAS 250WR: INTRODUCTION TO EAST ASIAN STUDIES,https://guides.main.library.emory.edu/c.php?g=212454
156,East Asian Studies,Research Guide to Japanese Studies,https://guides.main.library.emory.edu/c.php?g=50404
157,East Asian Studies,"WGS/ANT/EAS 385W Body and Culture in East Asia -- Spring 2018, Zhang",https://guides.main.library.emory.edu/body_and_culture
158,Economics,Data Resources and Support,https://guides.main.library.emory.edu/Data_Services
159,Economics,Data Resources for Econometrics (ECON 420),https://guides.main.library.emory.edu/EDC_ECON420
160,Economics,Data Resources for Economic Forecasting (ECON 422),https://guides.main.library.emory.edu/EDC_ECON422
161,Economics,Data Resources for Economists,https://guides.main.library.emory.edu/EDC_ECON
162,Economics,Data Resources for International Development,https://guides.main.library.emory.edu/EDC_DEVEL
163,Economics,Data Resources for International Finance (ECON 432),https://guides.main.library.emory.edu/EDC_ECON432
164,Economics,Data Resources: Development Issues for Africa (AFS 366W/ECON 366W),https://guides.main.library.emory.edu/EDC_ECON366-000
165,Economics,Data Resources: Political Economy of Violence and Non-Violence (MESAS 370-003),https://guides.main.library.emory.edu/EDC_MESAS370_003
166,Economics,Economics Current Contents,https://guides.main.library.emory.edu/econrss
167,Economics,Economics Honors Guide,https://guides.main.library.emory.edu/economics
168,Economics,Economics/Political Science/International Studies 385: India Today,https://guides.main.library.emory.edu/contemporary_india
169,Education,Data Resources and Support,https://guides.main.library.emory.edu/Data_Services
170,Education,Educational Studies--Current Research,https://guides.main.library.emory.edu/ed_studies_research
171,Education,Foundations for Online Teaching,https://guides.main.library.emory.edu/c.php?g=572228
172,Education,"Grants, Foundations, and Scholarships",https://guides.main.library.emory.edu/Grants
173,Education,Psychological and Educational Measurement Instruments Guide,https://guides.main.library.emory.edu/tests_and_measures
174,Education,The Scholarship of Teaching and Learning,https://guides.main.library.emory.edu/sotl
175,Emory College Seminars (ECS),"Grants, Fellowships & Scholarships for Undergraduates",https://guides.main.library.emory.edu/undergraduate_grants
176,Emory College Seminars (ECS),QEP First-Year Seminar Faculty Toolkit,https://guides.main.library.emory.edu/QEP_Faculty_Toolkit
177,English & North American Literature,American Literature Research Guide,https://guides.main.library.emory.edu/c.php?g=50848
178,English & North American Literature,Civil Rights Cold Cases,https://guides.main.library.emory.edu/cold-cases
179,English & North American Literature,Climate Change & Society,https://guides.main.library.emory.edu/climate
180,English & North American Literature,ENG 101-1: Expository Writing: News Literacy in the Digital Age -- TEFTT,https://guides.main.library.emory.edu/news_literacy
181,English & North American Literature,Eng 181: Ghost Stories,https://guides.main.library.emory.edu/c.php?g=822458
182,English & North American Literature,Eng 210W: Edgar Allan Poe,https://guides.main.library.emory.edu/c.php?g=822152
183,English & North American Literature,English 101: Climate Change and Multimedia,https://guides.main.library.emory.edu/English101_climate_change
184,English & North American Literature,English 101: Writing about Anything,https://guides.main.library.emory.edu/Eng101_WriteAboutAnything
185,English & North American Literature,English 101: You Are What You Eat,https://guides.main.library.emory.edu/english101_youarewhatyoueat
186,English & North American Literature,English 490 Honors,https://guides.main.library.emory.edu/english490_honors
187,English & North American Literature,English Literature Research Guide,https://guides.main.library.emory.edu/english
188,English & North American Literature,First Year Composition - Research Guide,https://guides.main.library.emory.edu/c.php?g=561031
189,English & North American Literature,First-Year Composition Instructor Toolkit,https://guides.main.library.emory.edu/FYCToolkit
190,English & North American Literature,Literature and Environment Research Guide,https://guides.main.library.emory.edu/c.php?g=50791
191,English & North American Literature,Medieval and Early Modern Literature,https://guides.main.library.emory.edu/medievalearlymodernliterature
192,English & North American Literature,Shakespeare in the Heilbrun Music & Media Library: A Guide to Audio and Visual Resources,https://guides.main.library.emory.edu/AV_Shakespeare
193,Environmental Sciences,Climate Change & Society,https://guides.main.library.emory.edu/climate
194,Environmental Sciences,Data Resources and Support,https://guides.main.library.emory.edu/Data_Services
195,Environmental Sciences,Data Resources for International Environmental Policy (ENVS 377/POLS 384),https://guides.main.library.emory.edu/EDC_ENVS377WR-000
196,Environmental Sciences,Ecology,https://guides.main.library.emory.edu/ecology
197,Environmental Sciences,Environmental Honors & Independent Research Guide,https://guides.main.library.emory.edu/envstHonorsIndependentResearch
198,Environmental Sciences,Environmental Sciences Field Studies,https://guides.main.library.emory.edu/ends_field
199,Environmental Sciences,Environmental Sciences Films,https://guides.main.library.emory.edu/envstEnvironmentalFilms
200,Environmental Sciences,Ethnobotany,https://guides.main.library.emory.edu/ethnobotany
201,Environmental Sciences,International Environmental Policy,https://guides.main.library.emory.edu/internationalpolicy
202,Environmental Sciences,Literature and Environment Research Guide,https://guides.main.library.emory.edu/c.php?g=50791
203,Environmental Sciences,Media and the Environment,https://guides.main.library.emory.edu/environmentalmedia
204,Environmental Sciences,U.S. Environmental Policy,https://guides.main.library.emory.edu/envspolicy
205,Environmental Sciences,WaterHub & Wastewater management,https://guides.main.library.emory.edu/waterhub
206,Film and Media Studies,A Film Studies Research Guide,https://guides.main.library.emory.edu/film_general
207,Film and Media Studies,Equipment Collections at Emory,https://guides.main.library.emory.edu/equipment
208,Film and Media Studies,FILM 208 - Digital Media and Culture,https://guides.main.library.emory.edu/film_208_allison
209,Film and Media Studies,FILM 270 - Introduction to Film - Lerner,https://guides.main.library.emory.edu/film_270_lerner
210,Film and Media Studies,FILM 356: History Of American Television,https://guides.main.library.emory.edu/FILM_356_History_American_Television
211,Film and Media Studies,FILM 396R - Japanese Anime,https://guides.main.library.emory.edu/film396r_japanese_anime
212,Film and Media Studies,FILM 403 - The Biz,https://guides.main.library.emory.edu/film_403_the_biz
213,Film and Media Studies,FILM 404 - Sexuality and Media Narratives,https://guides.main.library.emory.edu/film_404_sexuality_and_media_narratives
214,Film and Media Studies,FILM 406 - Columbia Pictures - Bernstein,https://guides.main.library.emory.edu/film_406_sp2018_bernstein
215,Film and Media Studies,FILM 406 - War in Film and Media (Allison),https://guides.main.library.emory.edu/c.php?g=623235
216,Film and Media Studies,FILM 503 - Censorship in Film and Television - Fall 2017,https://guides.main.library.emory.edu/film_503_fall_2017
217,Film and Media Studies,FILM 506: Methods in Film and Media Studies,https://guides.main.library.emory.edu/film_506_methods
218,Film and Media Studies,Film and Entertainment Industry,https://guides.main.library.emory.edu/film_and_entertainment_industry
219,Film and Media Studies,Media and the Environment,https://guides.main.library.emory.edu/environmentalmedia
