,Category,Subject,Link
220,Film and Media Studies,Music in Film,https://guides.main.library.emory.edu/musicinfilm
221,Film and Media Studies,Postwar Soviet Cinema,https://guides.main.library.emory.edu/Postwar_Soviet_Cinema
222,Film and Media Studies,Resources for Film History Research,https://guides.main.library.emory.edu/c.php?g=50080
223,Film and Media Studies,Shakespeare in the Heilbrun Music & Media Library: A Guide to Audio and Visual Resources,https://guides.main.library.emory.edu/AV_Shakespeare
224,Film and Media Studies,Television Research Guide,https://guides.main.library.emory.edu/television
225,French,A French Language and Literature Research Guide,https://guides.main.library.emory.edu/french
226,French,"Francophone World Resources: Africa, the Americas, Asia, and the Caribbean",https://guides.main.library.emory.edu/FrancophoneWorld
227,French,French and Francophone Culture,https://guides.main.library.emory.edu/Francophone_Culture
228,French,La France Contemporaine: Histoires des Familles,https://guides.main.library.emory.edu/Histoires_des_Familles
229,Geography and Maps,Geography and Maps,https://guides.main.library.emory.edu/geography
230,Geography and Maps,Topographic Maps,https://guides.main.library.emory.edu/topographic
231,German,German Language and Literature Guide,https://guides.main.library.emory.edu/german
232,Global Health,Data Resources and Support,https://guides.main.library.emory.edu/Data_Services
233,Global Health,Fertility and Mortality in Cultural Context (GHCS 300R),https://guides.main.library.emory.edu/fertilityandmortality
234,Global Health,Gender and Global Health (GHCS 300R),https://guides.main.library.emory.edu/gender_globalhealth
235,Global Health,Global Health: Biosocial Model (ANT 338W),https://guides.main.library.emory.edu/biosocialhealth
236,Global Health,Health and Disease in Africa,https://guides.main.library.emory.edu/AfricaHealth
237,Government Documents,British Parliamentary Papers Research Guide,https://guides.main.library.emory.edu/BritishParliamentaryPapers
238,Government Documents,U.S. Government Documents Guide,https://guides.main.library.emory.edu/government_documents
239,Government Information,British Parliamentary Papers Research Guide,https://guides.main.library.emory.edu/BritishParliamentaryPapers
240,Government Information,Data Resources and Support,https://guides.main.library.emory.edu/Data_Services
241,Government Information,U.S. Government Documents Guide,https://guides.main.library.emory.edu/government_documents
242,Graduate Students,Applying to Philosophy Graduate Programs,https://guides.main.library.emory.edu/PhilGradSchoolGuide
243,Graduate Students,Data Resources and Support,https://guides.main.library.emory.edu/Data_Services
244,Graduate Students,"Digital Image Guide - Finding, Using, and Creating Digital Image Collections",https://guides.main.library.emory.edu/DigitalImages
245,Graduate Students,Ten Things for Grad Students to Know about the Libraries,https://guides.main.library.emory.edu/TENTHINGSFORGRADS
246,Graduate Students,Zotero,https://guides.main.library.emory.edu/zotero
247,Health,Data Resources and Support,https://guides.main.library.emory.edu/Data_Services
248,Health,Ethnobotany,https://guides.main.library.emory.edu/ethnobotany
249,Health Sciences,Evolutionary Medicine (ANT 334),https://guides.main.library.emory.edu/evolutionarymedicine
250,Health Sciences,Health and Disease in Africa,https://guides.main.library.emory.edu/AfricaHealth
251,Health Sciences,SciFinder,https://guides.main.library.emory.edu/scifinder
252,"History, Ancient (-400)",A Classics Research Guide,https://guides.main.library.emory.edu/CLASSICSGuide
253,"History, Ancient (-400)",Ancient History Research Guide,https://guides.main.library.emory.edu/ancienthistory
254,"History, Ancient (-400)","HIST 487RW-2: Roman Imperialism: Empeor, Senate and Provinces",https://guides.main.library.emory.edu/roman_imperialism_spring2018
255,"History, Ancient (-400)",Women and Family in Roman Law and Life,https://guides.main.library.emory.edu/women_and_roman_law
256,"History, Early Modern (1450-1800)",Medieval History Research Guide,https://guides.main.library.emory.edu/medievalhistory
257,"History, European",Ancient History Research Guide,https://guides.main.library.emory.edu/ancienthistory
258,"History, European",European History Research Guide,https://guides.main.library.emory.edu/EuropeanHistory
259,"History, European",HIST 190: Fake News in the Contemporary World,https://guides.main.library.emory.edu/hist190_fake_news
260,"History, European",HIST 190: Radicals and Revolutions: An Introduction to Caribbean History,https://guides.main.library.emory.edu/hist190_radicals_and_revolutions
261,"History, European",HIST 385 - Human Trafficking: A Global History,https://guides.main.library.emory.edu/humantrafficking
262,"History, European",HIST 385: Global Aid in an Unequal World,https://guides.main.library.emory.edu/hist385spring2018
263,"History, European",HIST 487: Internationalism in the Twentieth Century,https://guides.main.library.emory.edu/hist487internationalismfall2017
264,"History, European","HIST 487RW-2: Roman Imperialism: Empeor, Senate and Provinces",https://guides.main.library.emory.edu/roman_imperialism_spring2018
265,"History, European","HIST190: Britain, Empire and the World",https://guides.main.library.emory.edu/hist190_british_empire_spring2018
266,"History, European","HIST: 385W ""Scandal: Dangerous Texts of Enlightenment""",https://guides.main.library.emory.edu/hist385enlightenment
267,"History, European",Medieval History Research Guide,https://guides.main.library.emory.edu/medievalhistory
268,"History, Georgia & Southern",Emory University History,https://guides.main.library.emory.edu/eua
269,"History, Georgia & Southern",Right Wing America,https://guides.main.library.emory.edu/RightWing
270,"History, Middle Ages (400-1450)",Ancient History Research Guide,https://guides.main.library.emory.edu/ancienthistory
271,"History, Middle Ages (400-1450)",Medieval History Research Guide,https://guides.main.library.emory.edu/medievalhistory
272,"History, Modern (1800-)",Britain and the World,https://guides.main.library.emory.edu/britainandtheworld
273,"History, Modern (1800-)",HIST 190: Fake News in the Contemporary World,https://guides.main.library.emory.edu/hist190_fake_news
274,"History, Modern (1800-)",HIST 385 - Human Trafficking: A Global History,https://guides.main.library.emory.edu/humantrafficking
275,"History, Modern (1800-)",HIST 385: Global Aid in an Unequal World,https://guides.main.library.emory.edu/hist385spring2018
276,"History, Modern (1800-)",HIST 487: Internationalism in the Twentieth Century,https://guides.main.library.emory.edu/hist487internationalismfall2017
277,"History, U.S.",African American History and Culture (Rose Library),https://guides.main.library.emory.edu/c.php?g=50191
278,"History, U.S.",Atlanta Newspaper Guide,https://guides.main.library.emory.edu/atlanta-newspapers
279,"History, U.S.",Civil Rights Cold Cases,https://guides.main.library.emory.edu/cold-cases
280,"History, U.S.",Data Resources and Support,https://guides.main.library.emory.edu/Data_Services
281,"History, U.S.",Data Resources for Historians,https://guides.main.library.emory.edu/EDC_HIST
282,"History, U.S.",Economics/Political Science/International Studies 385: India Today,https://guides.main.library.emory.edu/contemporary_india
283,"History, U.S.",Emory University History,https://guides.main.library.emory.edu/eua
284,"History, U.S.",HIST 190: Fake News in the Contemporary World,https://guides.main.library.emory.edu/hist190_fake_news
285,"History, U.S.",HIST 190: Radicals and Revolutions: An Introduction to Caribbean History,https://guides.main.library.emory.edu/hist190_radicals_and_revolutions
286,"History, U.S.",HIST 385 - Human Trafficking: A Global History,https://guides.main.library.emory.edu/humantrafficking
287,"History, U.S.",HIST488: Professions in American History,https://guides.main.library.emory.edu/professions
288,"History, U.S.",HIST488RW: Race & Empire in the Era of the U.S. Revolution,https://guides.main.library.emory.edu/Race_Empire
289,"History, U.S.",History Dissertations Arranged by Date,https://guides.main.library.emory.edu/History_Dissertations
290,"History, U.S.",How do I find newspapers?,https://guides.main.library.emory.edu/united-states-newspapers
291,"History, U.S.",Nazi Medicine on Trial,https://guides.main.library.emory.edu/nazi-medicine
292,"History, U.S.",Passing(s) in American History,https://guides.main.library.emory.edu/passings
293,"History, U.S.",Primary Sources for Colonial America,https://guides.main.library.emory.edu/colonial
294,"History, U.S.",Primary Sources for Twentieth Century America,https://guides.main.library.emory.edu/20th-century
295,"History, U.S.",Primary Sources on Nineteenth Century America,https://guides.main.library.emory.edu/19th-century
296,"History, U.S.",Primary Sources on Women's History,https://guides.main.library.emory.edu/womens-history
297,"History, U.S.",Primary Sources Research Guide,https://guides.main.library.emory.edu/primary_sources_overview
298,"History, U.S.",Right Wing America,https://guides.main.library.emory.edu/RightWing
299,"History, U.S.",The Civil Rights Movement,https://guides.main.library.emory.edu/civil-rights-movement
300,"History, U.S.",United States History Research Guide,https://guides.main.library.emory.edu/united-states-history
301,"History, World",A Guide to Archival Research,https://guides.main.library.emory.edu/archives-research-program
302,"History, World",Ancient History Research Guide,https://guides.main.library.emory.edu/ancienthistory
303,"History, World",Britain and the World,https://guides.main.library.emory.edu/britainandtheworld
304,"History, World",British Parliamentary Papers Research Guide,https://guides.main.library.emory.edu/BritishParliamentaryPapers
305,"History, World",Course Guide to History 489SWR: JR/SR Colloquium: History of Western Medicine in China,https://guides.main.library.emory.edu/c.php?g=49999
306,"History, World",Data Resources and Support,https://guides.main.library.emory.edu/Data_Services
307,"History, World",Data Resources for Historians,https://guides.main.library.emory.edu/EDC_HIST
308,"History, World",Economics/Political Science/International Studies 385: India Today,https://guides.main.library.emory.edu/contemporary_india
309,"History, World",European History Research Guide,https://guides.main.library.emory.edu/EuropeanHistory
310,"History, World",HIST 190: Fake News in the Contemporary World,https://guides.main.library.emory.edu/hist190_fake_news
311,"History, World",HIST 385 - Human Trafficking: A Global History,https://guides.main.library.emory.edu/humantrafficking
312,"History, World",HIST 385: Global Aid in an Unequal World,https://guides.main.library.emory.edu/hist385spring2018
313,"History, World",HIST 487: Internationalism in the Twentieth Century,https://guides.main.library.emory.edu/hist487internationalismfall2017
314,"History, World","HIST190: Britain, Empire and the World",https://guides.main.library.emory.edu/hist190_british_empire_spring2018
315,"History, World",Medieval and Early Modern Literature,https://guides.main.library.emory.edu/medievalearlymodernliterature
316,"History, World",Medieval History Research Guide,https://guides.main.library.emory.edu/medievalhistory
317,"History, World",Nazi Medicine on Trial,https://guides.main.library.emory.edu/nazi-medicine
318,"History, World",Newspapers of the French Revolution - Chronological Index,https://guides.main.library.emory.edu/c.php?g=50188
319,"History, World",Primary Source Research in Latin American History,https://guides.main.library.emory.edu/c.php?g=50013
320,"History, World",Primary Sources Research Guide,https://guides.main.library.emory.edu/primary_sources_overview
321,"History, World",Renaissance Women Writers,https://guides.main.library.emory.edu/Renaissance_Women_Writers
322,"History, World",US Cold War and Foreign Policy,https://guides.main.library.emory.edu/cold-war-foreign-policy
323,"History, World",War Crimes and Genocide,https://guides.main.library.emory.edu/war-crimes
324,Honors Students,AAS495A: African American Studies Honors Research,https://guides.main.library.emory.edu/AFAM_Honors
325,Honors Students,ARTHIST495RW: Art History Honors,https://guides.main.library.emory.edu/ArtHistoryHonors
326,Honors Students,Data Resources and Support,https://guides.main.library.emory.edu/Data_Services
327,Honors Students,Environmental Honors & Independent Research Guide,https://guides.main.library.emory.edu/envstHonorsIndependentResearch
328,Honors Students,HIST495: Introduction to Historical Interpretation (History Honors),https://guides.main.library.emory.edu/histhonors
329,Honors Students,Math & Computer Science Honors Research Guide,https://guides.main.library.emory.edu/mathcomputerscihonors
330,Honors Students,Zotero,https://guides.main.library.emory.edu/zotero
331,Interdisciplinary Studies,Animal Studies Research Guide,https://guides.main.library.emory.edu/c.php?g=50800
332,Interdisciplinary Studies,IDS 390 - Interdisciplinary Studies Tutorial - SP 2017,https://guides.main.library.emory.edu/ids_390_sp_2016
333,Interdisciplinary Studies,Literature and Environment Research Guide,https://guides.main.library.emory.edu/c.php?g=50791
334,Interdisciplinary Studies,Medieval and Early Modern Literature,https://guides.main.library.emory.edu/medievalearlymodernliterature
335,International,Data Resources and Support,https://guides.main.library.emory.edu/Data_Services
336,Italian Studies,Italian Studies Research Guide,https://guides.main.library.emory.edu/italian
337,Jewish Studies,Biblical Archaeology Research Guide,https://guides.main.library.emory.edu/c.php?g=49930
338,Jewish Studies,Holocaust Research Guide,https://guides.main.library.emory.edu/c.php?g=49936
339,Jewish Studies,Israel From the Palestine Mandate to the Present: A Research Guide,https://guides.main.library.emory.edu/c.php?g=49946
340,Jewish Studies,Jewish Studies Collections,https://guides.main.library.emory.edu/jewishstudies
341,Jewish Studies,Jewish Studies Research Guide,https://guides.main.library.emory.edu/c.php?g=49929
342,Journalism,Atlanta Newspaper Guide,https://guides.main.library.emory.edu/atlanta-newspapers
343,Journalism,Civil Rights Cold Cases,https://guides.main.library.emory.edu/cold-cases
344,Journalism,Data Resources and Support,https://guides.main.library.emory.edu/Data_Services
345,Journalism,ENG 101-1: Expository Writing: News Literacy in the Digital Age -- TEFTT,https://guides.main.library.emory.edu/news_literacy
346,Journalism,Journalism 301: Advanced News Reporting & Writing,https://guides.main.library.emory.edu/Journalism301AdvancedNews
347,Latin American & Caribbean Studies,A Latin American & Caribbean Studies Guide,https://guides.main.library.emory.edu/c.php?g=49954
348,Latin American & Caribbean Studies,Brazilian Studies,https://guides.main.library.emory.edu/c.php?g=238575
349,Latin American & Caribbean Studies,Latin American Cinema Guide,https://guides.main.library.emory.edu/c.php?g=50235
350,Latin American & Caribbean Studies,Primary Source Research in Latin American History,https://guides.main.library.emory.edu/c.php?g=50013
351,"Lesbian, Gay, Bisexual and Transgender Studies",LGBT Studies Microfilm Research Guide,https://guides.main.library.emory.edu/lgbtmicrofilm
352,"Lesbian, Gay, Bisexual and Transgender Studies",LGBT Studies Research Guide,https://guides.main.library.emory.edu/lgbtguide
353,"Lesbian, Gay, Bisexual and Transgender Studies",Library of Congress Subject Headings for LGBT Studies,https://guides.main.library.emory.edu/queerlcsh
354,"Lesbian, Gay, Bisexual and Transgender Studies",Primary Sources for LGBT Research,https://guides.main.library.emory.edu/lgbtrare
355,LGBT Studies,LGBT Studies Microfilm Research Guide,https://guides.main.library.emory.edu/lgbtmicrofilm
356,LGBT Studies,LGBT Studies Research Guide,https://guides.main.library.emory.edu/lgbtguide
357,LGBT Studies,Library of Congress Subject Headings for LGBT Studies,https://guides.main.library.emory.edu/queerlcsh
358,LGBT Studies,Primary Sources for LGBT Research,https://guides.main.library.emory.edu/lgbtrare
359,Library and Information Science,Emory Libraries Technical Services,https://guides.main.library.emory.edu/elts
360,Library Publications,Library Survey Results & Analysis--2013 and previous years,https://guides.main.library.emory.edu/library_surveys
361,Library Publications,Preservation and Conservation,https://guides.main.library.emory.edu/preservation
362,Library Publications,RESC Division,https://guides.main.library.emory.edu/RESC_division
363,Library Publications,Subject Librarians,https://guides.main.library.emory.edu/librarians
364,Linguistics,Linguistics Research Guide,https://guides.main.library.emory.edu/c.php?g=49928
365,Mathematics,Math & Computer Science Honors Research Guide,https://guides.main.library.emory.edu/mathcomputerscihonors
366,Middle East Studies,Course Guide to CHN394: Screening China,https://guides.main.library.emory.edu/c.php?g=50144
367,Middle East Studies,Crusades,https://guides.main.library.emory.edu/Crusades
368,Middle East Studies,Data Resources: Islam in Europe (MESAS190-001),https://guides.main.library.emory.edu/EDC_MESAS190_001
369,Middle East Studies,Data Resources: Political Economy of Violence and Non-Violence (MESAS 370-003),https://guides.main.library.emory.edu/EDC_MESAS370_003
370,Middle East Studies,Qur'anic Studies,https://guides.main.library.emory.edu/quran
371,Middle Eastern Studies,Data Resources: Islam in Europe (MESAS190-001),https://guides.main.library.emory.edu/EDC_MESAS190_001
372,Middle Eastern Studies,Data Resources: Political Economy of Violence and Non-Violence (MESAS 370-003),https://guides.main.library.emory.edu/EDC_MESAS370_003
373,Middle Eastern Studies,Middle Eastern and Islamic Studies Research Guide,https://guides.main.library.emory.edu/middle_east
374,Middle Eastern Studies,Qur'anic Studies,https://guides.main.library.emory.edu/quran
375,Music,Advanced Classical Music Research Guide,https://guides.main.library.emory.edu/music_classical_adv
376,Music,Classical Music Research Guide,https://guides.main.library.emory.edu/music_classical
377,Music,Equipment Collections at Emory,https://guides.main.library.emory.edu/equipment
378,Music,"Ethnomusicology, World Music, and Folk Music Guide",https://guides.main.library.emory.edu/ethnomus
379,Music,Jazz and Popular Music Research Guide,https://guides.main.library.emory.edu/popmusic
380,Music,Jazz Research Guide (old),https://guides.main.library.emory.edu/jazz
381,Music,"MUS 356: Women, Music, and Culture",https://guides.main.library.emory.edu/womenmusic-online
382,Music,Music in Film,https://guides.main.library.emory.edu/musicinfilm
383,Music,Primary Sources for Music,https://guides.main.library.emory.edu/music_primary
384,Music,Quick Links for experienced music researchers,https://guides.main.library.emory.edu/MusicLinks
385,Music,Shakespeare in the Heilbrun Music & Media Library: A Guide to Audio and Visual Resources,https://guides.main.library.emory.edu/AV_Shakespeare
386,Music,Singers' Resources,https://guides.main.library.emory.edu/singers
387,Neuroscience & Behavioral Biology,NBB 190: The Adolescent Brain,https://guides.main.library.emory.edu/NBB190_adolescentBrain
388,Newspapers,African American Newspapers,https://guides.main.library.emory.edu/african-american-news
389,Newspapers,Atlanta Newspaper Guide,https://guides.main.library.emory.edu/atlanta-newspapers
390,Newspapers,How do I find newspapers?,https://guides.main.library.emory.edu/united-states-newspapers
391,Newspapers,New York Times @ Emory,https://guides.main.library.emory.edu/nytimes_at_emory
392,Newspapers,Newspapers of the French Revolution - Chronological Index,https://guides.main.library.emory.edu/c.php?g=50188
393,Open Access,Open Access,https://guides.main.library.emory.edu/OA
394,Open Access,Open Data,https://guides.main.library.emory.edu/opendata
395,Open Access,Open Educational Resources (OERs),https://guides.main.library.emory.edu/OERs
396,Philosophy,Ancient Portfolio Papers Guide,https://guides.main.library.emory.edu/Ancient
397,Philosophy,Applying to Philosophy Graduate Programs,https://guides.main.library.emory.edu/PhilGradSchoolGuide
398,Philosophy,Philosophy Research Guide,https://guides.main.library.emory.edu/philosophy
399,Philosophy,Primary Sources for Philosophy,https://guides.main.library.emory.edu/philosophy_primarysources
400,Physics,Library Resources and Services for Incoming Physics Graduate Students,https://guides.main.library.emory.edu/incomingphysicsgrads
401,Physics,SciFinder,https://guides.main.library.emory.edu/scifinder
402,Political Science,Data Resources and Support,https://guides.main.library.emory.edu/Data_Services
403,Political Science,Data Resources for International Development,https://guides.main.library.emory.edu/EDC_DEVEL
404,Political Science,Data Resources for International Environmental Policy (ENVS 377/POLS 384),https://guides.main.library.emory.edu/EDC_ENVS377WR-000
405,Political Science,Data Resources for Political Science,https://guides.main.library.emory.edu/EDC_POLS
406,Political Science,Data Resources on the European Union,https://guides.main.library.emory.edu/EDC_EU
407,Political Science,Economics/Political Science/International Studies 385: India Today,https://guides.main.library.emory.edu/contemporary_india
408,Political Science,International Environmental Policy,https://guides.main.library.emory.edu/internationalpolicy
409,Political Science,Political Science 385/African American Studies 385: New Black Political Leadership,https://guides.main.library.emory.edu/new_black_leadership
410,Political Science,Political Science 394: Political Economy of Labor and Development (Fall 2016),https://guides.main.library.emory.edu/political_economy_development
411,Political Science,"Political Science 494/WGS 475: Gender, Race and Political Representation in the U.S.",https://guides.main.library.emory.edu/pols490_race_gender_representation
412,Political Science,Political Science Research Guide,https://guides.main.library.emory.edu/polisci
413,Political Science,Political Science--Current Contents & Citation Analysis,https://guides.main.library.emory.edu/journals_polisci
414,Political Science,POLS 510 World Politics Assignment,https://guides.main.library.emory.edu/world_politics_510
415,Political Science,U.S. Environmental Policy,https://guides.main.library.emory.edu/envspolicy
416,Political Science,U.S. Public Policy Research,https://guides.main.library.emory.edu/public_policy
417,Political Science,US Cold War and Foreign Policy,https://guides.main.library.emory.edu/cold-war-foreign-policy
418,Preservation,Preservation and Conservation,https://guides.main.library.emory.edu/preservation
419,Psychology,*Current Articles in Psychology Journals,https://guides.main.library.emory.edu/psyc_rss
420,Psychology,Clinical Psychology Resources Guide,https://guides.main.library.emory.edu/clinical_psych
421,Psychology,PSYC 111: Introduction to Psychology II - Fall 2017 - Kim,https://guides.main.library.emory.edu/psyc111_kim_fall2017
422,Psychology,PSYC 190-5: How do we know what we know about parenting? -- Goodman,https://guides.main.library.emory.edu/psyc190_parenting
423,Psychology,"PSYC 200: Experimental Methods, Fall 2018 - Barber",https://guides.main.library.emory.edu/psyc200
424,Psychology,PSYC 205: Child Development -- Kim -- Summer 2018,https://guides.main.library.emory.edu/psyc_205_kim
425,Psychology,"PSYC 205: Child Development, STROCK -- Fall 2018",https://guides.main.library.emory.edu/psychology_205
426,Psychology,PSYC 210: Abnormal Psychology - Fall 2017 - Delawalla,https://guides.main.library.emory.edu/abnormal_psychology_fall2017
427,Psychology,"PSYC 212: Social Psychology -- Fall, 2017",https://guides.main.library.emory.edu/psyc212_strock
428,Psychology,"PSYC 311: Adolescent Psychology - STROCK, Fall 2018",https://guides.main.library.emory.edu/psyc311_strock
429,Psychology,Psychological and Educational Measurement Instruments Guide,https://guides.main.library.emory.edu/tests_and_measures
430,Psychology,Psychology Research Guide,https://guides.main.library.emory.edu/psyc_guide
431,Public Health,Data Resources and Support,https://guides.main.library.emory.edu/Data_Services
432,Public Health,Data Resources for International Development,https://guides.main.library.emory.edu/EDC_DEVEL
433,Public Health,Global Health: Biosocial Model (ANT 338W),https://guides.main.library.emory.edu/biosocialhealth
434,Public Health,WaterHub & Wastewater management,https://guides.main.library.emory.edu/waterhub
435,Religion,Qur'anic Studies,https://guides.main.library.emory.edu/quran
436,Religion,Religious Studies,https://guides.main.library.emory.edu/religion
437,Religion,RLR 700 - Hindu Shastras,https://guides.main.library.emory.edu/shastras
438,Religion,Yoga Research Guide,https://guides.main.library.emory.edu/yoga
439,Russian and East European Studies,Russ 270W/IDS 285W: Russian Culture,https://guides.main.library.emory.edu/RussianCulture
440,Russian and East European Studies,"Russian, East European and Eurasian Studies Research Guide",https://guides.main.library.emory.edu/c.php?g=49959
441,Science and Technology,WaterHub & Wastewater management,https://guides.main.library.emory.edu/waterhub
442,Sociology,Criminology & Miscarriage of Justice,https://guides.main.library.emory.edu/sociology2
443,Sociology,Culture and Society,https://guides.main.library.emory.edu/c.php?g=549472
444,Sociology,Data Resources and Support,https://guides.main.library.emory.edu/Data_Services
445,Sociology,Data Resources for International Development,https://guides.main.library.emory.edu/EDC_DEVEL
446,Sociology,Data Resources for Sociologists,https://guides.main.library.emory.edu/EDC_SOC
447,Sociology,Researching Urban Atlanta,https://guides.main.library.emory.edu/sociology_atlanta
